{
  "$schema": "https://json-schema.org/draft/2020-12/schema",
  "title": "DyKnow Config",
  "description": "Configuration for DyKnow Local repositories.",
  "type": "object",
  "additionalProperties": false,
  "required": [
    "projectName",
    "mode",
    "allowedSources",
    "pages",
    "approvalRequired",
    "llmProvider",
    "publishTargets"
  ],
  "properties": {
    "$schema": {
      "type": "string",
      "description": "Path to the local dyknow.config.schema.json file."
    },
    "projectName": {
      "type": "string",
      "minLength": 1
    },
    "mode": {
      "type": "string",
      "enum": [
        "local-only",
        "connected"
      ]
    },
    "allowedSources": {
      "type": "array",
      "minItems": 1,
      "items": {
        "type": "string",
        "minLength": 1,
        "pattern": "^(?![A-Za-z]:[\\\\/])(?![\\\\/])(?!.*(?:^|[\\\\/])\\.\\.(?:[\\\\/]|$))[^\\u0000\\r\\n]+$"
      }
    },
    "ignoredSources": {
      "type": "array",
      "default": [
        ".env",
        ".env.*",
        "secrets/**",
        "node_modules/**",
        "dist/**",
        "coverage/**",
        "logs/**"
      ],
      "items": {
        "type": "string",
        "minLength": 1,
        "pattern": "^(?![A-Za-z]:[\\\\/])(?![\\\\/])(?!.*(?:^|[\\\\/])\\.\\.(?:[\\\\/]|$))[^\\u0000\\r\\n]+$"
      }
    },
    "pages": {
      "type": "array",
      "minItems": 1,
      "items": {
        "type": "object",
        "additionalProperties": false,
        "required": [
          "id",
          "title",
          "outputPath",
          "audience",
          "sources",
          "reviewRules"
        ],
        "properties": {
          "id": {
            "type": "string",
            "pattern": "^[a-z0-9]+(?:-[a-z0-9]+)*$"
          },
          "title": {
            "type": "string",
            "minLength": 1
          },
          "outputPath": {
            "type": "string",
            "minLength": 1,
            "pattern": "^(?![A-Za-z]:[\\\\/])(?![\\\\/])(?!.*(?:^|[\\\\/])\\.\\.(?:[\\\\/]|$))(?!docs[\\\\/]sources(?:[\\\\/]|$))(?!\\.git(?:[\\\\/]|$))[^\\u0000\\r\\n]+$"
          },
          "audience": {
            "type": "string",
            "enum": [
              "internal",
              "external",
              "agent",
              "mixed"
            ]
          },
          "sources": {
            "type": "array",
            "minItems": 1,
            "items": {
              "type": "string",
              "minLength": 1,
              "pattern": "^(?![A-Za-z]:[\\\\/])(?![\\\\/])(?!.*(?:^|[\\\\/])\\.\\.(?:[\\\\/]|$))[^\\u0000\\r\\n]+$"
            }
          },
          "reviewRules": {
            "type": "object",
            "additionalProperties": false,
            "required": [
              "approvalRequired"
            ],
            "properties": {
              "approvalRequired": {
                "type": "boolean"
              }
            }
          }
        }
      }
    },
    "approvalRequired": {
      "type": "boolean",
      "default": true
    },
    "llmProvider": {
      "type": "string",
      "enum": [
        "local",
        "byo-key",
        "vendor-hosted"
      ]
    },
    "publishTargets": {
      "type": "array",
      "default": [],
      "items": {
        "type": "string",
        "minLength": 1
      }
    },
    "dependencyPolicy": {
      "type": "object",
      "additionalProperties": false,
      "default": {
        "allow": [],
        "deny": []
      },
      "properties": {
        "allow": {
          "type": "array",
          "default": [],
          "items": {
            "type": "string",
            "minLength": 1,
            "pattern": "^(?:@[a-z0-9][a-z0-9._-]*/)?[a-z0-9][a-z0-9._-]*$"
          }
        },
        "deny": {
          "type": "array",
          "default": [],
          "items": {
            "type": "string",
            "minLength": 1,
            "pattern": "^(?:@[a-z0-9][a-z0-9._-]*/)?[a-z0-9][a-z0-9._-]*$"
          }
        }
      }
    }
  },
  "allOf": [
    {
      "if": {
        "required": [
          "mode"
        ],
        "properties": {
          "mode": {
            "const": "local-only"
          }
        }
      },
      "then": {
        "properties": {
          "llmProvider": {
            "const": "local"
          },
          "publishTargets": {
            "maxItems": 0
          }
        }
      }
    }
  ],
  "examples": [
    {
      "$schema": "./dyknow.config.schema.json",
      "projectName": "DyKnow",
      "mode": "local-only",
      "allowedSources": [
        "README.md",
        "docs/**",
        "packages/**",
        ".github/**"
      ],
      "ignoredSources": [
        ".env",
        ".env.*",
        "secrets/**",
        "node_modules/**",
        "dist/**",
        "coverage/**",
        "logs/**"
      ],
      "pages": [
        {
          "id": "agent-context",
          "title": "AI Agent Context",
          "outputPath": "AGENTS.md",
          "audience": "agent",
          "sources": [
            "README.md",
            "docs/**",
            "packages/**"
          ],
          "reviewRules": {
            "approvalRequired": true
          }
        }
      ],
      "approvalRequired": true,
      "llmProvider": "local",
      "publishTargets": [],
      "dependencyPolicy": {
        "allow": [],
        "deny": []
      }
    }
  ],
  "$comment": "dyknow.config.json should reference this schema via its $schema property."
}
